{
  "manifestSchemaVersion": "alto9.io/pack-manifest/v1alpha1",
  "pack": {
    "name": "production-infra-baseline",
    "displayName": "Production Infrastructure Baseline",
    "description": "Example manifest for reviewers. Mirrors packs/production-infra-baseline/manifest.json at v1.0.0."
  },
  "version": "1.0.0",
  "releaseStatus": "released",
  "compatibility": {
    "policyEngine": {
      "semverRange": ">=0.1.0 <1.0.0"
    }
  },
  "artifacts": {
    "policyDocuments": [
      {
        "path": "policies/production-infra-baseline.yaml",
        "digest": "sha256:7b06cb981615373e33b41a16cfa7d2f78bae52ce7e5ab542703a80ddeffff385",
        "mediaType": "application/yaml",
        "description": "Readable ChangeControlPolicy document for platform and security review."
      }
    ],
    "compiled": [],
    "fixtureSuites": [
      {
        "path": "fixtures/suite.json",
        "digest": "sha256:29229afa1f9c4e1738a55edae0e6272459898348e148259fdf428b6fc4022082",
        "mediaType": "application/json",
        "description": "Fixture suite index proving deterministic classifier and rule evaluation for this pack version."
      }
    ]
  },
  "provenance": {
    "sourceRepository": "https://github.com/alto9/control9-policy-packs",
    "sourceRef": "production-infra-baseline/v1.0.0",
    "contentOrigin": "repository",
    "maintainers": ["platform-engineering"]
  }
}
